{
  "detectorVersion": "5.4.2",
  "minTokens": 50,
  "minLines": 5,
  "sourceRoots": ["."],
  "sourceFiles": [],
  "formats": {
    "rust": [".rs"],
    "python": [".py"],
    "typescript": [".ts", ".mts", ".cts"],
    "tsx": [".tsx"],
    "javascript": [".js", ".mjs", ".cjs"],
    "jsx": [".jsx"],
    "bash": [".sh"],
    "css": [".css"]
  },
  "extensionlessSources": "shebang",
  "exclusions": [
    {
      "pattern": "**/target/**",
      "reason": "Cargo emits generated build output and dependency sources here."
    },
    {
      "pattern": "crates/*/tests/fixtures/**",
      "reason": "These frozen repository projects are test inputs, rather than imported test implementations."
    },
    {
      "pattern": "**/.checks/**",
      "reason": "The committed provenance lock verifies these unchanged released checker dependencies."
    },
    {
      "pattern": "**/.git/**",
      "reason": "Git writes repository metadata rather than source."
    },
    {
      "pattern": "**/.contracts/**",
      "reason": "The installer locks these released third-party contract assets."
    },
    {
      "pattern": "**/__pycache__/**",
      "reason": "Python emits generated bytecode here."
    }
  ]
}
